{
  "protocol_version": "quest.questionnaire.v1",
  "schema": "quest.questionnaire.v1.result",
  "request_id": "f8d62b0a-77e8-4f7d-a7da-7f95fd9a7024",
  "nonce": "b96d9b51c4874db8a4e8f1b4",
  "status": "completed",
  "questionnaire": {
    "id": "brb-questionnaire-v1",
    "version": 1
  },
  "stage": "post_condition:pictographic",
  "condition_number": 1,
  "screen_sequence": [
    "post_condition:pictographic",
    "post_condition:presence_questionnaire",
    "post_condition:lost_opportunity"
  ],
  "answers": {
    "open_stage": "post_condition:pictographic",
    "completed_stage": "post_condition:lost_opportunity",
    "screen_sequence": [
      "post_condition:pictographic",
      "post_condition:presence_questionnaire",
      "post_condition:lost_opportunity"
    ],
    "condition_number": 1,
    "post_condition": {
      "presence_slider": 64,
      "redness_vas": 71,
      "redness_likert": 5,
      "presence_questionnaire": {
        "spatial_presence_1": 3,
        "spatial_presence_2": 4,
        "involvement_1": 3,
        "experienced_realism_1": 4,
        "interaction_memory_1": 5
      },
      "lost_opportunity_acknowledged": true
    }
  },
  "started_at": "2026-06-13T21:10:00Z",
  "submitted_at": "2026-06-13T21:11:14Z",
  "error": null
}
