{
  "protocol_version": "quest.questionnaire.v1",
  "schema": "quest.questionnaire.v1.result",
  "request_id": "f8d62b0a-77e8-4f7d-a7da-7f95fd9a7024",
  "nonce": "b96d9b51c4874db8a4e8f1b4",
  "status": "completed",
  "questionnaire": {
    "id": "brb-questionnaire-v1",
    "version": 1
  },
  "stage": "final:end_confirmation",
  "condition_number": null,
  "screen_sequence": [
    "final:end_confirmation",
    "final:extra_presses_prompt",
    "complete:export_summary"
  ],
  "answers": {
    "open_stage": "final:end_confirmation",
    "completed_stage": "complete:export_summary",
    "screen_sequence": [
      "final:end_confirmation",
      "final:extra_presses_prompt",
      "complete:export_summary"
    ],
    "condition_number": null,
    "final": {
      "end_confirmation_rating": 10,
      "selected_10": true,
      "unity_owns_final_physical_presses": true
    }
  },
  "started_at": "2026-06-13T21:20:00Z",
  "submitted_at": "2026-06-13T21:21:14Z",
  "error": null
}
